id	text	se_tag
1	Finalmente, el aragonés se hizo con su tercera victoria en Burlada.	expl
2	Les recomienda que visiten la web (www.farmaceuticonline.com) para informarse sobre los efectos nocivos de su consumo.	expl
3	Ahí se desfondó el Deportivo, igual que Guardado dos carreras antes.	expl
4	Dio un golpe de timón para adjudicarse la primera pole de una temporada que acaba de arrancar pero que promete un duelo.	iobj
5	Sólo se dirigía a mí para pedirme cosas, que si un chicle, que si algo para comer…	expl
6	Lo que cobraban estas jugadoras no era mucho dinero, pero sí el suficiente como para hacer tambalearse los cimientos del fútbol femenino español.	expl
7	Ha completado un año excepcional, reinando en España y en Europa, y alzándose con un cuarto puesto en el Mundial de Daegu.	expl
8	Suiza, que había logrado este año el ascenso al Grupo Mundial, se jugará la permanencia con uno de los vencedores de las eliminatorias zonales.	expl
9	Herrera afrontó la escalada de ambas placas tras calzarse sus primeros pies de gatos, en septiembre de 1977.	expl
10	La embajada de España en Islamabad ha registrado el fallecimiento del empresario español desaparecido en la torre Margalla de Islamabad que se desplomó en el seísmo del día 8.	expl
11	El Juzgado de Guardia de Tudela se ha hecho cargo de las investigaciones.	expl
12	Entonces se desconocía casi todo sobre la nandrolona.	se-mark
13	Aún hoy no se sabe exactamente de dónde puede proceder.	se-mark
14	"El trabajo del diafragma será parte de nuestro patrón respiratorio, aumentando el diámetro vertical del tórax en la inspiración y disminuyéndolo en el momento de exhalar	  éste, a su vez, es sostenido en cada ciclo respiratorio por el suelo pélvico, dándo"	se-mark
15	El andaluz, medallista de plata en Atenas 2004, vuelve a casa con un diploma olímpico, pero le queda el consuelo de la victoria de su íntimo amigo británico, Ben Ainslie, que ayer se convirtió definitivamente en un mito olímpico al conseguir el triunfo, l	expl
16	Me dedico a leer todo lo que se está publicando sobre la boda real en Inglaterra.	se-mark
17	El Numancia pudo dar la vuelta al marcador en un remate franco de Sergi Enrich (min. 38), a pase de Natalio, pero su disparo, en boca de gol, se fue contra José Juan.	expl
18	El Soho se podría decir que es también el barrio gay de Londres, ya que la comunidad gay juega un importante papel muy importante en el barrio y tiene gran culpa de la prosperidad del Soho.	se-mark
19	Las celebraciones después de marcar un gol se han convertido en motivo de controversia, lo que indica bien a las claras que los españoles andamos bastante desocupados.	expl
20	Gran botín se lleva nuestros vecinos ibéricos de la cita en Sevilla, ya que dos compatriotas de Enriques, Mónica Rosa y Helena Sampaio, fueron las primeras clasificadas en la carrera femenina.	expl
21	Pero no sucedió así y con el 0-0 se llegó al descanso.	se-mark
22	Cogió el coche de reserva y a pocas vueltas del final fue descalificado por la dirección de carrera ya que sólo se puede hacer uso del segundo coche sólo hasta 15 segundos antes de que dé inicio el calentamiento.	se-mark
23	Si quiere comprobarlo, puede intentar presentarse un domingo al mediodía a comer a casa de sus padres sin llevar al retoño.	expl
24	Ubicada en el centro geopolítico de la República de Bolivia, a una altitud de 2.560 m y a unas siete horas por carretera de La Paz, se trata de una ciudad activa, vital y progresista que, si bien no cuenta con tantos atractivos turísticos como Sucre o Pot	se-mark
25	El Madrid no encontró soluciones para deshacerse de la maraña táctica rojiblanca.	expl
26	Los lectores del periódico se han volcado con la iniciativa en la que ellos mismos han propuesto a los candidatos.	expl
27	Kilómetros de costa de arena o piedras blancas relucientes que contrastan con el color azul turquesa caribe que parece casi de mentira, con palmeras de cocos levantándose desafiantes en todas las direcciones y que recuerdan que por aquí frecuentan ciclone	expl
28	Antiguamente, nuestros padres se conformaban con tapar los enchufes y no guardar el salfumán en botellas de refresco.	expl
29	La destitución se produjo unas horas después de que el Milán fuese eliminado de la Liga de Campeones.	se-mark
30	Además recalcó la importancia de que el equipo se mantenga en ACB para poder continuar con el resto de iniciativas del club (cantera, labor social, etc.).	expl
31	En el barrio se puede cenar cualquier cosa a un precio razonable.	se-mark
32	En ese caso, se te pedirá que tu historial sea demostrable y que introduzcas tus operaciones por adelantado en alguna base de datos o blog de apuestas.	se-mark
33	Nunca como ahora se ha demandado a los cocineros que, armados hasta los dientes de máquinas, lleguen también al espíritu, al sentimiento.	se-mark
34	Es la gran sorpresa del momento porque se está defendiendo de manera sobresaliente.	obj
35	Sobre el paisaje que rodea la masía San Jaime, el refugio ideal del modisto, siguen jugando las gotas de agua que se esconden entre el césped y las chumberas.	obj
36	Y con esta escueta información y con la más escueta, si cabe, referencia al tercer aniversario de Compritas que se cumple hoy mismo -y que no vamos a celebrar de un modo especial porque me acabo de dar cuenta-, me despido hasta el lunes no sin antes desea	se-mark
37	Por entonces ya se le conocía como el santo de Manmad.	se-mark
38	La producción empezó a compartirse entre España y Extremo Oriente.	se-mark
40	Según esto, fácilmente se constata la pureza del aire que baña los bosques de esta zona.	se-mark
41	Gough, ex militar de la Marina británica, ha sido advertido de que podría dar con sus huesos en prisión para siempre si no accede, de una vez por todas, a vestirse, según informa hoy el diario británico The Independent.	obj
42	- La cuchara se coge por el mango, y descansando sobre el dedo pulgar.	se-mark
47	Sin embargo, su mayor éxito —en cuanto a premios se refiere— le vino por su papel en Adiós con el corazón, por la que recibió el Goya a la mejor interpretación masculina en 2000.	se-mark
48	Los primeros anuncios se intalaron en 1916 después de que saliera una ordenanza municipal que incitaba a colocar letreros en esta parte de la ciudad.	se-mark
50	Como estoy escribiendo sobre Amsterdam casi de memoria, (fuimos en Diciembre de 2006) pondré algunos lugares que vimos, de entre la gran cantidad de cosas que se pueden hacer.	se-mark
52	El galo, que evita la comparación con su compatriota Zinedine Zidane --No se me puede comparar con Zizou, él es una leyenda, señala--, sí confía en su selección.	se-mark
54	En el Museo Nacional Arqueológico, entre otros objetos valiosos, se puede admirar una pieza que posiblemente sirvió como frontal de una fuente de la judería.	se-mark
56	Y no olvides nunca que tras ese contexto sereno y elegante, imprescindible para que los cauces del toreo discurran con el temple que hoy exigimos, con la calidad que demandamos, con el perfecto ajuste de organización en la corrida que nos gusta paladear, 	se-mark
57	Y el tratamiento que se da a Andoni Luis Adúriz, a Quique Dacosta, a Massimo Bottura, a Nuno Mendes, a David Toutain, a Diego Guerrero y a la magia dulce de Jordi Roca.	se-mark
58	Monopolizan también el mercado femenino conveniente al pudor y la modestia de las mujeres y las hijas que permiten hacerse vestir por personas de su mismo sexo, mientras que ellas lo juzguen apropiado.	iobj
61	Estoy deshecha por tener que anunciar que no podré competir en Sochi, dijo la campeona olímpica, que tras romperse los ligamentos cruzados en 2013 siente aún una inestabilidad importante en la rodilla derecha, de la que fue operada hace 11 meses.	iobj
63	Si bien esto era algo que McCartney quería evitar a toda costa, la aceptación de la cifra fijada por el juez se debe principalmente a que la cuantía no la considera excesiva.	se-mark
65	Aparte de la Yamaha de Rossi, uno de los grandes dolores de cabeza de Honda desde que empezó la temporada ha sido el problema del llamado chattering, —que podría traducirse como 'castañeteo'—.	se-mark
66	GAP y H&M, por ejemplo, diseñan y venden, pero no fabrican, y Benetton diseña y fabrica, pero sus puntos de venta se entregan en franquicia.	se-mark
68	La gente que sabe comer bien no necesita estar limpiándose la boca continuamente.	iobj
70	De esta forma se confirma la tendencia de los últimos meses, en los que la tasa de paro decrecía de mes en mes aunque con porcentajes inferiores a los del año pasado.	se-mark
73	Luego se pone una tira de masa recubriendo la parte que ha quedado más fina por el palo.	se-mark
75	Pese a ello, la mayoría de las crónicas realizadas resultaron muy pobres al limitarse a la narración de los resultados, datos y estadísticas y al no ahondar en las claves informativas que caracterizan este género.	se-mark
77	Antonio Chazarra, ante la publicación de un publirreportaje en la revista EasyJet en el que se ensalza la obra del Valle de los Caídos, ha expresado su estupefacción y desagrado por un texto que ha sido pagado con el dinero de todos los ciudadanos madrile	se-mark
78	Esto se explica porque no despierta la simpatía de muchos, pero pocos pueden negarle su calidad futbolística.	se-mark
79	Un problema menos, debió pensar el seleccionador español, que se aposentó con calma en el banquillo cuando vio que Trapattoni mandaba a sus futbolistas al ataque con una utopía entre ceja y ceja.	expl
80	Pese a esas palabras, pocos dudan en Birmingham del ambiente de tensión que se respira en la comunidad musulmana después de la muerte de tres de sus miembros.	se-mark
81	Cavenaghi se convierte en el tercer fichaje del Villarreal para la próxima temporada, tras las contrataciones de los defensas Javi Venta y el sueco Olof Mellberg.	expl
82	¿Qué se lleva?	se-mark
83	Claro está que ninguno de los dos se arrepiente de nada, pero seguro que echan de menos aquellos tiempos en que disfrutaban.	expl
84	Normalmente se instalan barras en las diferentes zonas de la ciudad, a las que acuden los lugareños.	se-mark
85	No parecía confiar lo suficiente en nadie como para iniciar una relación seria y además estaba demasiado ocupado con el ajedrez, al que se dedicaba con una disciplina monástica por largas temporadas.	expl
86	En el mes de julio se realizó en esta misma ciudad una concentración nacional de nuevos valores dirigida por el técnico Javier Añúa.	se-mark
87	No es algo que le moleste, pero sí recalca que en las tareas que le han asignado se comporta como una profesional.	expl
88	Los triples de Martínez y Laviña permitieron la primera ventaja local (6 – 2), pero los hombres de Aranzana reaccionaron de inmediato y con un parcial de 2 – 11 se situaron cinco arriba (8 – 13) en el primer cuarto.	expl
89	Error monumental que en los últimos tiempos se ha encargado de dejar en evidencia a otro compañero suyo, Casillas, que ya luce galones en la Selección, y a pesar de eso no ha dejado de ser igual de natural y accesible que antes.	expl
90	El agua se precipita desde la cordillera de Sama a una altura de 30 m, tomando distintas tonalidades.	expl
91	Y si se comunicaba con Dios, qué menos que desafiarlo a una partida de ajedrez.	expl
92	Un club que quiere tener una estructura profesional debe preocuparse y trabajar por ello, aprovechando la labor de sus técnicos en todas sus funciones.	expl
93	"La cápsula protege el corcho del aire, las impurezas y la luz	 una cápsula limpia y flexible nos indica que el corcho se ha conservado bien protegido."	expl
94	Un breve paseo nos permite admirar el entorno natural apreciando como bajo los pies de un viejo castiñeiro y una banda de piedra caliza con varias hendiduras brotan manantiales de agua de la Sierra do Mirador que se abren paso entre líquenes y musgo.	expl
95	El agua está fría, pero en pocos minutos uno se acostumbra.	expl
96	Lo que sale bien no se toca.	se-mark
97	Me quedaban dos jornadas para terminar con la llamada back road, la carretera de montaña que une Yunnan con Sichuan, que he estado siguiendo esta última semana, abierta a los turistas desde 1999 donde se puede entrar en la vida tibetana sin tener que entr	se-mark
98	Sin ir más lejos, sus barricas, todas ellas de roble americano y francés, con un precio aproximado del doble de las que se pueden encontrar en otras bodegas.	se-mark
99	Y eso que el partido se iniciaba con dos equipos conformados al ataque enfrascados en una batalla en el centro del campo que hasta los 18 minutos no encontraba presencia en una u otro área.	se-mark
100	El presidente, sin embargo, es consciente de que en invierno tendrá que volver a rascarse el bolsillo.	iobj
101	Hay diferentes variedades que además ayudarán a eliminar parte de la humedad que se acumula en esta parte de la casa.	se-mark
102	En mis proyectos apuesto por que las cosas parezcan que se han hecho solas.	se-mark
103	Renuevan la máquina con la que se pinchan los greenes dos veces al año como norma.	se-mark
104	Joan Gaspart aclaró ayer en la presentación de Coco por qué el defensa italiano llega ahora como cedido y su fichaje definitivo se ha aplazado para la próxima temporada.	se-mark
105	"Una vez que la jima ha concluido, las piñas o mezcales se llevan a los grandes hornos para ser tatemados	 esto es, proceder a su cocimiento."	se-mark
106	Si con posterioridad al envío de la documentación se produjeran modificaciones sobre la cantidad a reclamar, los jugadores deberán ponerlo en conocimiento de la AFE.	se-mark
107	Sobre todo porque hasta hace muy pocos años no se había producido el tuteo.	se-mark
108	Asimismo, San Martín recriminó al equipo de gobierno que no se hubiera explicado el acuerdo a la Asociación de Vecinos de Santiago, agrupación que en su día solicitó a la Diputación un uso preferencial de estas instalaciones, ubicadas en este barrio.	se-mark
109	"A mediodía hará cola en uno de los albergues municipales para coger sitio	 luego lavará ropa y se echará la siesta."	expl
110	En páginas interiores señala que «los rumores van muy deprisa y se habla ya de planes de boda entre Francisco Álvarez Cascos y María Porto, pero no hay que precipitar los acontecimientos.	se-mark
111	Lo cierto es que este año ya hemos visto bonitas goleadas y que Benítez, vistas las cosechas vergonzantes de los duelos Carletto-Simeone, se ha ganado el derecho a que un empate contra el Atleti sea considerado venial.	expl
112	Pero aquí es preciso detenerse para admirar su abundante y rico patrimonio histórico-artístico, entre el que destaca el conjunto monumental de San Vicente del Pino con su monasterio y torreón medieval, los restos de las antiguas murallas, la iglesia barro	expl
113	Como explica The Independent, Terry Schumacher, su dueña, la confundió con una rata cuando se la encontró abandonada detrás de un edificio de apartamentos.	expl
114	"En Argentina, en materia deportiva, se llevan los aplausos el fútbol, cuya cara más conocida es Diego Armando Pelusa Maradona	 el automovilismo, con la imagen del quíntuple campeón del mundo Juan Manuel Fangio	 y el tercer deporte en discordia, el boxeo, "	expl
115	El mosaico rural se completa con la presencia de parcelas de frutales, terrenos de labor y parcelas.	se-mark
116	Por el contrario, en los métodos activos de enseñanza, el aprendizaje se realiza por la vía del descubrimiento.	se-mark
117	El expresidente del Fútbol Club Barcelona Joan Laporta no se ha pronunciado sobre su participación en las elecciones en el club del próximo verano, mientras que Agustí Benedito, que ya confirmó hace tiempo su presencia en los comicios, calificó la decisió	expl
118	En el tomate de Los Palacios (un pueblo de Sevilla que tiene 200 días de sol) no hay diferencia entre piel y carne, es como comerse un filete muy carnoso.	expl
119	Quique contuvo a Agüero y le tapó la boca cuando el argentino se fue hacia el cuarto árbitro a descargar su ira mientras lanzaba un insulto tras otro: sólo vio la amarilla.	expl
120	Por el momento la ampliación del Campeonato regional sólo podría hacerse sobre la base de las cuatro provincias catalanas.	se-mark
121	Según ha informado el diario británico Daily Mirror, Abramovich, de 42 años, se siente muy feliz por el nacimiento del pequeño Aaron Alexander Abramovich el pasado jueves en Los Ángeles (EEUU).	expl
122	Interviú recalca que ha abordado los orígenes profesionales de Pilar Rubio con la mayor deferencia y admiración ante una persona que comenzó como modelo fotográfica y publicitaria para revistas y ha logrado ocupar un lugar preeminente en el panorama nacio	se-mark
123	La ampliación del calendario para la próxima temporada y la falta de tiempo para estar junto a su familia se han convertido en obstáculos insalvables, confirmaba el madrileño.	expl
124	No engaña Pochettino con su discurso y apretó arriba, atrevido en la presión y capaz de desconectar a un Barça impreciso que se asoció mal, beneficiado por lo bien que gestionó ambas porterías.	expl
125	Olivia Palermo, no contenta con ser sólo modelo de revista, ahora va más allá y deja los front-row para subirse a las pasarelas.	expl
126	El conjunto blanco se aleja del segundo puesto tras empatar ante un Getafe que mereció la victoria.	expl
127	Pero hay demasiada dependencia de Valerón y el canario no está, no ha estado desde hace meses y, visto lo que hay, no se le espera.	se-mark
128	Hubo un interesante debate que se prolongó más de lo previsto.	iobj
129	La investigación se debe a las acusaciones del entrenador del Luton, Mike Newell, quien dijo que le ofrecieron el cobro de comisiones ilegales.	se-mark
130	Y todo el mundo augura que se las verán dos equipos con amplios banquillos.	iobj
131	En los presentes tampoco brilló el ambiente de fiesta que se vive en los encuentros especiales.	se-mark
132	Cortar en bastoncillos el apio que se había reservado.	se-mark
133	Con el terremoto de la ampliación de capital flotando en el ambiente, la plantilla azul ha intentado abstraerse del tema para pensar solo en la dura prueba que depara la Liga tras el parón navideño.	obj
134	Cuando se juega bien y el equipo está unido es lo que más importa para el país.	se-mark
135	El futbolista andaluz está deseoso de regresar a España porque ni él ni su familia se han adaptado a la vida en Londres.	expl
136	Reclamaciones (de gente a la que echan los porteros o porque no les dejan entrar ateniéndose a su derecho de admisión).	expl
137	El Sur de Asia se encuentra en plena época del monzón, que afecta la región desde julio a septiembre.	expl
138	El empleo, sin embargo, se ha desacelerado una décima, hasta el 1,4%, debido a pérdidas en la construcción y en la agricultura.	se-mark
139	Amancio nos aclaró que él era muy sensible, con un punto de orgullo muy fuerte en su interior, y que tras rebelarse por las palabras que acababa de oír, tomó una decisión irrevocable: Esto no le volverá a pasar a mi madre nunca más.	expl
140	Creado el 5 de septiembre de 1826 durante el Gobierno del mariscal Antonio José de Sucre, el departamento de Oruro tiene una historia que se remonta hasta los urus, una de las culturas más antiguas del continente, aunque también habitaron este departament	expl
141	En principio puede parecer un sofá bastante normal, de hecho con un diseño formal muy sencillo, salta a la vista el toque del combinado bicolor y poco más, pero si nos fijamos en los detalles no le falta prácticamente nada, se llama Palet, es una propuest	expl
142	Por último, Atlético de Madrid y Rayo se enfrentarán el jueves.	obj
143	Los investigadores consideran que Pappalardi mató a los niños la misma noche de su desaparición, mientras los castigaba por haber salido a la calle sin permiso y a pesar de que se lo había prohibido.	iobj
144	Su erudición -da muestras de conocerse el árbol genealógico de todos los imputados- contrasta con su sonado fracaso.	expl
145	Hasta Río Sidra llegan las avionetas, y desde aquí se puede ir en bote hasta las magníficas islas de alrededor.	se-mark
146	De este modo, el suceso ha ocurrido en un restaurante de la Avenida Juan Carlos I de la capital murciana, cuando el hombre, tras ingerir la comida, ha empezado ha encontrarse mal y ha entrado en parada.	expl
147	El ViveMenorca sacó el carácter en el tercer cuarto y se acercó a tres puntos de su rival, pero no pudo aguantar hasta el final el mejor oficio de los malagueños con un Ndong estratosférico, autor de 24 puntos en los 26 minutos que disputó.	expl
148	Al respecto, Foacal sostiene que la artesanía, vinculada por tradición a los entornos rurales (actualmente acogen al 61% de estos profesionales), si es rentable puede convertirse en un imán capaz de atraer población estable a los pueblos.	expl
149	Las distancias no son muy grandes, pero siempre que no vayan muy cargados, porque las zonas de arena donde se entierran las ruedas abundan por todos los caminos.	se-mark
150	El espadazo también se le cayó al torero francés en los bajos con el vareado tercero, montado, degollado.	expl
151	Entre los clientes se encontraban altos cargos empresariales, profesionales diversos y una decena de futbolistas pertenecientes en su mayoría a la plantilla del Inter.	expl
152	En este último país se celebró en 1981 una exposición antológica de su moda y el Museo Victoria and Albert de Londres le dedicó en 1990 una exposición retrospectiva.	se-mark
153	En función de eso, los responsables del centro le diseñarán un horario que se ajuste a sus necesidades laborales, dado que la mayoría de sus actuaciones y galas tienen lugar por la noche.	expl
154	Petroesla Mansilla tuvo un enfrentamiento complicado, o más bien ellos solitos se lo complicaron en los últimos compases del duelo.	iobj
155	Unos ofrecen sitio en sus coches a desconocidos para entrar en Manhattan, o solidariamente trasladan a sus vecinos, pero algunos conductores de coches de alquiler y taxistas tratan de hacer su agosto cobrando precios desorbitados y saltándose las tarifas 	expl
156	Los rojiblancos se imponen con autoridad al Jaén en el Calderón.	expl
157	El porche que veis arriba es pequeño, pero muy acogedor, con un sillón en teca, que resiste muy bien las condiciones de frío y calor que se pueden dar a lo largo del año en Madrid.	se-mark
158	Michael Brown es escenógrafo de pasarelas, se encarga de dotar a los desfiles de un halo mágico y sorprendente para que estos permanezcan grabados en la memoria de los asistentes.	expl
159	Y no era gratuito: en realidad no se sabe muy bien si fue antes el huevo o la gallina, o en este caso, si fue antes la pitón o el apodo.	se-mark
160	¿A los dependientes se les da la mano?	se-mark
161	Dentro de los premios, están las menciones honoríficas a gente que no se ha matado pero que podría haberlo hecho por cometer una estupidez.	expl
162	Más tarde a las 5.30 horas se produjo otro incendio que afectó a un total de cinco vehículos a la altura del número 1 de la calle José Montgrell.	se-mark
163	Los Suns suman seis derrotas y se sitúan en la tercera posición de la Conferencia Oeste por detrás de Los Lakers y de Denver.	expl
164	Sport mantiene que los manotazos de Cristiano para quitarse a los jugadores blanquiverdes de encima cuando fueron a increparle por su pata a Edimar son puñetazos certeros.	iobj
165	El acoso y derribo al marco universitario se mitigó con los minutos y los colegiales cogieron aire aunque despreciaron a la suerte.	se-mark
166	Libro de ásperas páginas donde se han grabado a cincel versos inolvidables.	se-mark
167	Los efectos positivos se empiezan a notar mucho antes.	se-mark
168	Hasta 2002 sus declaraciones de Hacienda eran fiables: a partir de 2003 cuando comenzó su relación con Julián Muñoz, se convirtieron en un caos.	iobj
169	Ven las líneas que dominan, los colores y materiales que se utilizan, y los siguen de cerca.	se-mark
170	Y me extrañaba mucho que inmediatamente saliera fuera lo que se hablaba en el vestuario.	se-mark
171	El funeral por Gurrea Casado se oficiará mañana en la capilla de San Pedro de la Ciudadela de Jaca (Huesca), según ha confirmado el General Jefe de la Brigada de Cazadores de Montaña Aragón I, Fernando Sánchez Lafuente.	se-mark
172	Será un espacio semanal, aunque la periodista aún no ha querido concretar qué día se emitirá ni a qué hora.	se-mark
173	Una gran cualidad de Beníez es que generalmente sabe comprar bien cuando se abre el mercado de traspasos.	se-mark
174	Afganistán, tras la pista del dólar se emite en Documentos TV, hoy, a las 22.30 horas, por La 2.	se-mark
175	Es un rival duro, con un juego vertical, que tiene velocidad, buen juego aéreo y que es el clásico equipo alemán: duro y que no se entrega nunca.	expl
176	Los partidos se jugarán el 13 de noviembre la ida y el 2 de enero la vuelta.	se-mark
177	Pero debemos tener presente que el gato necesita que esos elementos se muevan.	se-mark
178	Ésta es una labor que debe hacer se cada temporada y no solamente una vez en la vida.	se-mark
179	Una delegación de Trabajo se desplazó al pueblo y les detalló el procedimiento.	expl
180	A las clases, se va.	se-mark
181	Y no se olvide de los terrenos, también es muy importante la composición arcilloso calcárea.	expl
182	Ayer se dio a conocer que Duane da Roca, del Club Natación Mijas, no podrá disputar este torneo debido a una lesión.	se-mark
183	"Reputadas editoras de la revista se despachaban a gusto con los blogueros: Patéticos les llamaba Sarah Mower	 tristes añadía la discreta Nicole Phelps."	expl
184	Así, el equipo más fuerte se enfrentaba al hándicap de empezar perdiendo.	expl
