id	text	se_tag
793	Unicef sabe que los niños que se benefician de programas de desarrollo en la primera infancia obtienen mejores resultados en la educación primaria y tienen una menor tasa de abandono escolar, un problema muy común en las comunidades pobres.	expl
794	En el resto de encuentros adelantados al sábado, el Murcia dio un paso más en su pelea por evitar el descenso gracias al triunfo (0-1) en Córdoba, mientras que el Castellón perdió gran parte de sus opciones de salvación tras caer (0-1) frente al Girona, q	expl
795	Durante el día de ayer, Cassano había recibido la visita de un grupo de hinchas del Milan, a quienes refirió que hubiera sido mejor si se rompía una pierna que este problema en el corazón.	iobj
796	En un país en el que los deportes de equipo necesitaban épicas actuaciones para llegar a las fases finales en las que en muchas ocasiones les estaba reservado el papel de comparsas, 'La Roja' de la canasta ha logrado hacerse un hueco y sentir el máximo re	iobj
797	El presidente del Becerril, Juan Antonio Redondo, se mostró ayer muy satisfecho por esta resolución.	expl
798	El centrocampista pidió el cambio en los últimos minutos del último encuentro liguero ante el Almería, y aunque pudo jugar 79 minutos frente el Olympique, no se ejercitó con el resto de sus compañeros y estuvo bajo tratamiento con los fisioterapeutas.	obj
799	Unos [por el Gobierno] organizan la cumbre, nosotros colaboramos para que sea un éxito y otros, que son muchos, se dedican a tener la tentación de deslucirla, dijo De la Torre.	expl
800	De sus reflexiones en voz alta se desprende que está aturdido y que piensa cumplir su palabra.	se-mark
801	Su funeral se oficiará el lunes, 14 de abril, a las 20.30 horas, en la parroquia de Nuestra Señora del Perpetuo Socorro (Manuel Silvela, 16), de Madrid.	se-mark
802	En quinto lugar, la consolidación de un patrimonio propio se hizo condición necesaria para acudir al mercado de capitales, ante la disminución —que no desaparición— de las aportaciones a fondo perdido de socios pudientes.	se-mark
803	Según el tipo y variedad, con el paso del tiempo se volverá dorado, y con más años tendrá tonos topacio.	se-mark
804	A pesar de la distancia que aleja a las raquetas española de los momentos de enjundia de los grandes torneos del circuito, el conjunto que capitanea Miguel Margets se asoma al éxito en la Copa Federación, la competición por equipos más importante de la te	expl
805	El resto de los titulares, que junto al resto de la plantilla saltó al campo de la ciudad deportiva tras cuarenta minutos de charla con el técnico Unai Emery en los vestuarios, se ejercitaron durante tan solo un cuarto de hora antes de regresar al interio	obj
806	Los emisarios del Madrid se marcharon antes, por lo que a Samuel le tocó hacer el viaje hacia la capital de España en solitario, únicamente con la presencia junto a él de aquel compañero —Antoine Olise— del que nunca más supo, pues no pasó la prueba.	expl
807	Algo que los luthier protegen con mimo para que su sello se cotice.	se-mark
808	Mientras, un surafricano gemelo de Ernie Els, pero con mucha menos fortuna en su andadura profesional, se afianzaba en el primer puesto.	expl
809	El equipo húngaro demostró en la primera mitad por qué hasta hoy en el Veszprem Arena solo había perdido un encuentro -ante el Montpellier (22-23)- desde su inauguración en 2008, pero en la segunda parte los azulgrana jugaron a un nivel altísimo hasta alz	expl
810	Para este encuentro, Neven Spahija, técnico del conjunto valenciano, únicamente tendrá la baja de Víctor Claver, que aunque ya se ha reincorporado al trabajo de sus compañeros tras su lesión, aún no disputará el choque.	expl
811	También podría decirse que es su forma de estar compensado o equilibrado.	se-mark
812	Creo que se había marcado el objetivo de hacer dos mil puntos desde el Abierto hasta Miami.	iobj
813	Bautista, tras las caídas de Talmacsi, Baldolini y Pesek se encontró con una cuarta posición muy valiosa para sumar puntos para el campeonato.	expl
814	La euforia que estábamos viviendo se empañó de pronto con la noticia que nos llegó de nuestro Excmo.  Ayuntamiento: el inmueble donde estábamos amenazaba ruina y era motivo de derribo.	expl
815	En las grabaciones se ve lo que digo, que le dé el dinero a mis compañeros y que le dé dinero a los equipos que jugaban contra el que iba igual a puntos con nosotros, pero siempre por ganar.	se-mark
816	Espero que a este posible afectado de ébola en Alicante se le den los mismos cuidados que en el hospital CarlosIII de Madrid.	se-mark
817	No obstante, cada vez que regreso a Lastres, mi particular homenaje se fundamenta en las sardinas asadas y en la sidra.	se-mark
818	@David_Bel yo he hecho el salto contrario y no dejo de extrañar mi android, pero que se te bloquee tanto no es normal.	expl
819	Yo creo que ha habido chicas que pensaban que haciéndose de la peña iban a tener acceso a jugadores o a otras cosas.	expl
820	Cuando te siguen, se ríen y bromean, lo has conseguido, añade.	expl
821	A la llamada han acudido cientos de personas, que se han presentado hoy a las pruebas que el parque ha llevado a cabo en Madrid.	expl
822	De momento, todo esto ocurrirá en el teatro Palacio Valdés, que se edificó en los años veinte por suscripción popular, con un aforo de 1.000 plazas cuando la ciudad tenía 12.000 habitantes.	se-mark
823	Coma, defensor del título, entró a 39 minutos y 35 segundos de Chaleco, y se sitúa a más de una hora y cuarto de Despres en la clasificación general.	expl
824	En lo futbolístico, la prensa (tanto la inglesa como la española) ya se ha hecho eco del interés que tiene el millonario Roman Abramovich, dueño del Chelsea, en que Fernando Torres cambie el rojo por el azul la próxima temporada.	expl
825	Ovadía se ha presentado en Madrid con tres cocineros de su equipo y con producto traído directamente de México.	expl
826	La mano derecha de Berlusconi se levantó de su asiento para aplaudir la decisión del colegiado, lo que elevó todavía más la tensión.	expl
827	El recuerdo del Celta está siendo un martirio para el guardameta: en la Liga Catanha le marcó tres goles y luego se lesionó y hoy precisamente regresa a Balaídos bajo la sombra del italiano.	iobj
828	La única intención al realizar este libro es poner al servicio del interés general, mediante el método pilates, una guía útil para iniciarse, además de un documento de lectura que pueda estimular la motivación a todas aquellas personas que desconocen la o	expl
829	El Valladolid que se adelantó con un tanto de David Sousa, que no puso rentabilizar el equipo local.	expl
830	Panticosa tiene 41 pistas, fáciles en su mayoría: 7 verdes y 14 azules, a las que se añaden 16 rojas, de dificultad media, existiendo sólo 4 negras.	se-mark
831	En el Project Gotham Racing 2 no sólo se reconocen los monumentos.	se-mark
832	Su fragancia se debe a la enorme concentración de una sustancia conocida como acetilpirrolina, presente en todos los arroces pero en cantidades imperceptibles.	se-mark
833	Pedrosa mejora respecto a la cita en Qatar aunque se queda en la undécima posición.	expl
834	El Granada se creció y retomó el mando del choque a la vez que Teixeira Vitienes terminó de enfadar a Los Cármenes al no ver penalti por una mano de Lamah dentro del área osasunista (m.74) que reclamaron los locales.	expl
835	Sólo habían pasado 10 días desde la eliminación en la Champions y la herida podía reabrirse.	se-mark
836	- Para cabellos rizados suelen aplicarse espumas y geles de alta definición, con los cabellos húmedos o secos, como toque final.	se-mark
837	Un cabezazo suyo se ve cada tarde de partido en el Santiago Bernabéu, en el vídeo que acompaña el nuevo himno del club.	se-mark
838	Las reacciones tras el ataque no se hicieron esperar.	se-mark
839	Por su parte, el Celta de Vigo se juega su permanencia en Primera División, en un derbi gallego que llega con polémica tras la decisión de los organismos de no unificar horarios en esta penúltima jornada y las palabras de Horacio Gómez hace unas semanas s	expl
840	Habrá música por todos los rincones y se repartirán abanicos de color plata entre el público.	se-mark
841	El Atlético comenzó con buenas maneras, pero se esfumaron tan pronto como Salva no supo qué hacer con una de esas pelotas que parecen diseñadas para un guerrillero como él.	expl
842	Rehogamos hasta que se ablanden, sin que lleguen a tomar color.	se-mark
843	Igualmente, parece estar probado que a mediados del siglo XVIII el clásico abrigo largo resultaba muy molesto para montar a caballo y se le quitó su parte delantera para que no estorbara durante las muchas horas que los caballeros de la época pasaban a lo	se-mark
844	Una de las trabajadoras del Ministerio de Sanidad no se ha enterado de nada, aún parece bastante desconcertada.	expl
845	Semejantes manjares se pueden regar con agua fresca de la fuente o realizando una parada técnica en el bar.	se-mark
846	La estrella fue a pedir explicaciones y no se le ocurrió otra cosa que utilizar el cuerpo como forma de intimidación.	expl
847	"Cuando recurrimos a técnicas respiratorias de relajación, se nos aconseja realizar unas cuantas respiraciones cortas y rápidas, cuanto más cortas y rápidas,mejor	 para poder volver en seguida al trabajo."	se-mark
848	Manuel Jiménez, vicepresidente de la Comisión Gestora de las Fiestas de las Hogueras de San Juan, se congratuló de que esta jornada de convivencia, en la que también intervendrán los familiares y amigos de las protagonistas, sea en Castellón este año, des	iobj
849	No tuvo tiempo para impacientarse la afición local porque en el minuto 17 llegó el gol de Joseba Llorente, primero en la Liga, que culminó una jugada trenzada y adornada con un buen pase del lateral De la Bella.	expl
850	El sueño europeo del Tau se acaba en Moscú.	se-mark
851	Medio millar de simpatizantes de Ciutadans se concentraron en el céntrico establecimiento barcelonés para arropar a los líderes del partido, especialmente a su candidato Albert Rivera.	expl
852	Y Bruno, que cumplió por el otro lado, no es lateral y se quedó helado.	expl
853	Metzelder y Van Nistelrooy tampoco se ejercitaron con el grupo.	obj
854	No es poco perder cinco diputados cuando se ha gobernado, apuntó Piqué en referencia a los socialistas tras subrayar que han sufrido un descalabro electoral pese a la presencia constante de Zapatero en la campaña catalana.	se-mark
855	Y continuó en los siguiente diez minutos, alcanzándose un máximo de 28 puntos de diferencia tras 18 minutos de juego, 28-56.	se-mark
856	Con una mañana primaveral se aceleró.	se-mark
857	La provincia de Lugo, Reserva de la Biosfera en su mayor parte, aglutina multitud de espacios medioambientales y paisajísticos donde se desarrollarán diferentes actividades que tienen por objeto el conocimiento y concienciación del medio físico como mejor	se-mark
858	También afirman que se emociona con facilidad, como sucedió en los Juegos Olímpicos de Barcelona, o por causas más tristes, como la muerte de su abuelo, el Conde de Barcelona.	expl
859	España contra Cataluña hoy no se puede concebir, me decía hoy alguien, comentó Maragall en una entrevista en TV-3.	se-mark
860	Aparecerán los hoteles pop-up, que se instalan para festivales o grandes citas deportivas.	se-mark
861	Me los imaginaba cogiendo al bebé en brazos y dándole un golpe contra el canto de un armario al girarse con él.	expl
862	La página web del aeropuerto de Zaventem insta a los viajeros a comprobar si su vuelo ha sido cancelado antes de presentarse en el lugar.	expl
863	También esta semana es Junior quien aparece en la portada de Hola para sincerarse y hablar de su historia de amor.	expl
864	Los animales salvajes se diferencian según sus especies, en tanto que los domésticos lo hacen según sus razas.	expl
865	Las personas se ha alquilado un piso en Barcelona.	expl
866	Los pupilos de Maljkovic se vinieron abajo cuando Vidal y Hansen entraron en pista.	expl
867	Porque la nueva imagen de la reina no sólo minaba la autoridad del traje a la francesa sino que se mostraba plenamente acorde con ciertos ideales modernos de corte político e intelectual, participando de la anglomanía del momento.	expl
868	Estos dos últimos tenistas tienen que jugar la final mañana miércoles a las 18 horas, ya que no se pudo celebrar el domingo por falta de tiempo.	se-mark
869	Lo normal es que se alterne en ambas posiciones.	se-mark
870	La pareja creó su familia en el extranjero y siempre quisieron que Nora y Leo, de 5 y 4 años respectivamente, se criaran cerca de sus abuelos.	expl
871	El pánico se ha apoderado de Zaragoza.	expl
872	Por fin Koldo Rodero no se arrugó entre los grandes organizadores del Forum de Girona y el de Madrid-Fusión.	expl
873	Allí se trasladaban en barcas de cuero a Viveiro para decir misa.	expl
874	Esa técnica tiene el riesgo de que la cometa se escape.	expl
875	La necesidad del triunfo de Boca le llevó a precipitarse y a desarrollar un trabajo barnizado de ansiedad y de imprecisiones, circunstancia que aprovechó un sosegado River para tomar ventaja en el marcador.	expl
876	el pulido se realiza después del crepado.	se-mark
877	En una imagen que la película La reina de los bandidos -que ella detestaba-, hizo célebre, se entregó con las cartucheras en medio de una gran ceremonia. 	obj
878	¿O, acaso, sus nietas y herederas no se han podido gastar doscientas mil pesetas en su recuerdo?	expl
879	En escasos minutos de descenso llegamos al ansiado Nogal del Barranco, conocido por los veteranos montañeros como La Cabra, por encontrarse en ella un monumento en honor a la joya gredense, la cabra montés o cabra hispánica (Capra hispanica victoriae).	expl
880	Al comprobar la desaparición del joven, el padrastro pudo contactar con sus compañeros de la ONCE, quienes a su vez lograron averiguar con qué amigos que había salido por la noche, quienes lo vieron por última vez a las 04.30 horas cuando se despidió para	expl
881	Si se mirase sólo desde el punto de vista de una empresa privada, es lógico pensar cómo aumentar las ganancias de su explotación.	se-mark
882	- La figura del ángel debe quedar oculta al espectador, pero en una posición que permita reflejarse la figura en el cristal cuando pongamos en marcha el efecto.	expl
883	Desde la ermita de San Gregorio, se plasman en romerías, dances y fiestas populares.	se-mark
884	Añadimos la leche poco a poco, sin dejar de remover con la batidora manual de varillas, hasta que la mezcla se suavice.	se-mark
885	Hasta ese momento Begoña se encontraba bajo la presión de participar en un concurso de televisión.	expl
886	Era tarea complicada lograrla en el Manuel Ruiz de Lopera frente a un Betis al alza y que se gusta en su fútbol y en su estadio.	iobj
887	Algunas personas permanecían agarradas a las partes del puente que no se habían hundido totalmente.	se-mark
888	- Para dar un aspecto más actual a los acabados dejar las puntas rectas y con movimiento, lo que se consigue aplicando ceras y fijadores que aporten flexibilidad y duración.	se-mark
889	Queda así desmentida la noticia ofrecida por la revista US Weekly, que aseguraba que la pareja se había dado el sí, quiero el pasado fin de semana en Florida en una ceremonia íntima a la que sólo habían acudido unos amigos.	iobj
890	El técnico del Unicaja, Aíto García Reneses, vigente campeón de la Copa del Rey cuando el año pasado entrenaba al DKV, y el preparador más laureado con cinco títulos en sus vitrinas, tiene claro que los pronósticos que se puedan hacer en esta competición 	se-mark
891	El albaceteño sigue recuperándose de una distensión en los aductores y su presencia está totalmente descartada contra el Zaragoza y es dudosa en el encuentro liguero del próximo domingo frente al Sevilla.	expl
892	Mancini no le ha hecho nada malo a Adriano, nunca se ha comportado de una forma negativa.	expl
893	Esta característica es la base sobre la que se asienta todo el Programa de Formación Individual, motivo de este libro.	se-mark
894	El catalán, que aún cuenta con opciones de alcanzar el subcampeonato de la categoría, volvió a ganar la partida a su principal oponente, Valentino Rossi (Yamaha), al marcar un tiempo de 1.33.150, y ubicarse cinco puestos por encima del italiano, que fue o	expl
895	El pabellón de deportes de Benavides de Órbigo pretende convertirse en un lugar de prestigio para el saber hacer confitero de la provincia, en el que todos los creadores quieran estar, sin dejar de lado el ambiente festivo que rodea a la cita.	expl
896	Con el transcurso del tiempo el adjetivo se transformó en sustantivo.	expl
897	Pero yo creo que más importante que este aspecto es la motivación y el acento que hemos puesto en la promoción interna, en las oportunidades individuales que se tienen para crecer dentro de la compañía.	se-mark
898	El fútbol canario siempre tuvo ese rasgo, con un ritmo lento y contagioso, pero en el Bernabéu apenas dejó soberbio remate cuando el Madrid ya se había puesto en 'off'.	expl
899	Será su primera experiencia europea, pero no se achica.	expl
900	La decimoséptima etapa del Giro'06, entre la localidad de Termeno y la estación de Furcia, que sustituyó a la llegada en Plan Coronas, tuvo como protagonistas al italiano Leonardo Piepoli (Saunier Duval), que ganó la segunda etapa en este Giro, y al tambi	iobj
901	Además, en las pocas ocasiones en las que conseguía perforarla, el conjunto maño se veía frenado por la ingente cantidad de faltas que cometía el conjunto bilbaíno, que no tenía ningún rubor en la reiteración de las mismas.	iobj
902	Si bien siempre dije que me gustaría quedarme siempre allá, a veces no todo se da como uno quiere, manifestó.	se-mark
903	Había cuatro iglesias, un par de hospitales para peregrinos y una importante judería desde la que se administraban el castillo y el horno.	se-mark
904	¿Cómo se enteraron?	expl
905	El tenista argentino Mariano Puerta dio positivo en un control antidopaje efectuado la víspera de su derrota en la final de Roland Garros del pasado 5 de junio, en la que se impuso el español Rafael Nadal, según informa este miércoles el diario L'Equipe.	expl
906	Los grupos Aramburu y Franco se edificaron hacia 1960, en pleno despegue industrial.	se-mark
907	El año pasado se produjeron casi 300 incidentes graves en las zonas costeras.	se-mark
908	La novia de américa jugó a ser 'Pretty Woman' por Avenue Montagne con su estilista, en vez de Rodeo Drive con Richard Gere, y se plantó un Armani que le sentaba mucho mejor que el peto vaquero que lleva a diario en su rancho de Nuevo México.	iobj
909	Cuando tengas que descongelar un trozo de pan en el microondas, envuélvelo en una hoja de papel absorbente, así evitarás que el pan se reseque y parecerá recién horneado.	se-mark
910	- Añadir el aromatizante, si se desea, con ayuda de una espátula.	se-mark
911	En el inmenso paddock de Shanghái, sentado en un rincón, cerré los ojos y se me vinieron a la cabeza miles de recuerdos: la remontada de Australia, la primera victoria que pude narrar de Fernando en Malasia, el carrerón de dos españoles en Bahréin, la ago	expl
912	En ocasiones, se comporta de manera prepotente.	expl
913	El propietario de la vivienda puede pedirte el aval de un banco o de una persona de confianza para asegurarse de que cobrará el alquiler cada mes.	expl
914	Esa pérdida se origina en los hurtos, así como en errores administrativos en los procesos y en la fijación de precios.	se-mark
915	Conocido internacionalmente, hasta la fecha Alejandro Sanz había podido cuidar su privacidad y mantenerse fuera de los focos.	obj
916	A la profesionalización se encaminaban distintos clubes españoles desde una posición desigual.	expl
917	Entre las sugerencias de Solís se encuentran las tapas de envoltini, erizo de mar y el salteado de langostinos con arroz y alioli.	se-mark
918	Allí se libró una gran batalla que terminó en victoria pirata.	se-mark
919	El mítico Ladislao Kubala, que permanece ingresado desde hace una semana en la clínica de El Pilar de Barcelona, se encuentra en la Unidad de Cuidados Intensivos del centro por una disminución de conciencia, mantiene una respiración espontánea y sus const	expl
920	El seleccionador también ha analizado las combinaciones que podría estar barajando John McEnroe para enfrentarse a España, especialmente la posibilidad de apostar por Mardy Fish para disputar alguno de los individuales.	expl
921	Para darse a conocer, la fundación ha editado un calendario para 2006 con una tirada de un millón de ejemplares.	expl
922	El alcalde de León, Francisco Fernández, y su teniente de alcalde, José María Rodríguez de Francisco, inauguraron ayer el parque que se ha construido en La Serna, en el solar donde antes estaba Tabacalera.	se-mark
923	La condición de choque rápido se vio desde los primeros minutos, con un juego muy directo, en ambos campos, de los que destacaría un activo Regueiro por parte valencianista.	se-mark
924	El día que se conoció la noticia de la desaparición de la piloto, Carmen escribió un tuit que rezaba: «Día muy triste… La vida es injusta a veces, luchaste mucho compañera por tu sueño y te vas como una gran campeona».	se-mark
925	En las últimas semanas se había acentuado el proceso terminal de un cáncer óseo que le fue detectado a finales del pasado año.	se-mark
926	Ahora, todo queda en el aire, cuando ya se cerró la fase regular.	se-mark
927	Las guías, tan socorridas desde que las pusieron de moda los viajeros franceses e ingleses de la ilustración y, sobre todo, del romanticismo, no paran de darnos sorpresas sin perder un ápice de interés ni de utilidad, alimentando nuestro conocimiento con 	expl
928	Del descubrimiento de flechas y artefactos en la actual ciudad de Nueva York se desprende que los manahattoes y canarsies fueron sus primeros pobladores antes de que llegaran a estas tierras los europeos.	se-mark
929	Además hay una ventaja añadida tratándose de España, me han dicho que sólo tardan 2 días en mandártelas y que no cobran gastos de transporte.	se-mark
930	Los ciudadanos de estas comarcas sólo están sujetos a esta legislación indígena cuando se encuentran dentro de su comarca: en el resto del país deben seguir las normas del resto de panameños.	expl
931	El Liverpool del español Rafa Benítez aprovechó la victoria del Betis sobre el Chelsea para auparse al liderato del grupo G gracias a su triunfo (3-0) sobre el Anderlecht belga, fundamentado en los goles de Morientes y Luis García.	expl
932	Cuando los fumadores gritan por su derecho a fumar, derecho que nadie les niega, pues sólo se les pide que no fuercen a hacerlo a los demás, me pregunto: ¿estará este derecho por encima del mío a vivir?	se-mark
933	Un torero de época que se ha anunciado con todos los encastes y ha triunfado en todas las plazas.	se-mark
934	Y muchas de las becas que se dan exigen que los chavales saquen buenas notas.	se-mark
935	He visitado el castillo de Pambre, que se acaba de abrir al público.	se-mark
936	Si la racha es negativa, se incrementa el descontento.	se-mark
937	"El vis a vis es como mínimo una vez al mes	 el máximo se deja al criterio del centro."	se-mark
938	El meta blanquiazul fue ovacionado pero el bloque visitante se crecía por momentos.	expl
939	Herreros hiló fino con los triples, Sonko apoyó en el interior y Hervelle, aunque sólo anotó seis puntos, se llevó casi todos los rebotes en ataque del Madrid.	expl
940	Si dejar a su hijo unas horas hizo que su mujer se sintiera como una bruja, dejarlo un fin de semana con los abuelos la sumirá en el más profundo sentimiento de culpa.	expl
941	Al sur de la capital la Asamblea del Pueblo Guaraní ha dado intrucción de bloquear los caminos, sumándose a los pedidos de nacionalización y convocatoria de Asamblea Constituyente, propuestas que no aceptan los empresarios de Santa Cruz y sus representant	expl
942	«Hay que decir que en el fútbol masculino se juega más al fútbol, es normal, tienen más veteranía —nos dijo—.	se-mark
943	Pero también me gustaría que se recordara que no estamos aquí por un regalo, porque he trabajado mucho para estar aquí, señaló.	se-mark
944	Rouco Varela pide alejarse del nacionalismo exacerbado y el racismo.	expl
945	Además, este modelo se combinará con el programa Festibike, una amplia propuesta de exhibiciones, pruebas, competiciones y distintas actividades para todos los públicos.	se-mark
946	Desde la Oficina de Turismo de Tailandia (Internet: www.tourismthailand.org) y diferentes touroperadores como Catai Tours (www.catai.es) y Viajes Dimensiones se asegura que la mayor parte de las playas y complejos hoteleros de Phuket, uno de los escenario	se-mark
947	Bodiroga se empeñó desde el primer partido en recortar iferencias con Benetton o Virtus.	expl
948	Más cerca de los 80 que de los 70, este vallisoletano sólo acertaba a recordar los muchos años de mi vida que me costó reunir cuatro millones de pesetas para que unos sinvergüenzas y estafadores se los lleven así por las buenas.	expl
949	Es un método perfecto para iniciarse en este maravilloso mundo en donde lo que cuenta es la imaginación, el buen gusto, el cariño y la paciencia.	expl
950	Relevadas a un segundísimo plano, sus presentaciones ni suelen aglutinar a centenares de periodistas expectantes, ni se dan colaboraciones sonadas con diseñadores de éxito.	se-mark
951	Y, si yo sé que Xavi se lesiona y no puede ir al Mundial, no jugaría, afirmó el entrenador azulgrana.	iobj
