id	text	se_tag
1577	"Los hilos de agua se trenzan para engordar al río Asón, que da nombre a la comarca, compuesta por seis concejos	 cada uno de ellos, con varios pueblos y pedanías."	se-mark
1578	Fin de semana nocturno, con la sala de prensa abierta hasta las cinco de la mañana, pilotos levantándose tarde y linternas en los boxes.	expl
1579	El visado se puede tramitar desde el país de origen o en el mismo aeropuerto a la llegada a Camboya.	se-mark
1580	Con todo, algunos comerciantes reconocieron que las primeras en agotarse son las variedades de las firmas más reconocidas.	se-mark
1581	Este abogado de profesión se propuso remozar la imagen del club a todos los niveles y lo está consiguiendo.	iobj
1582	"En palabras de Fran Ávila, la totalidad de los jugadores « se merecen un diez	 han hecho un partidazo»."	expl
1583	Según han informado fuentes de la aerolínea, el avión se disponía a las 7.30 hora local a entrar a la pista de despegue para partir con destino a la ciudad de Miami.	expl
1584	Por cantidades importantes a plazo fijo se pagaba un 10 por ciento.	se-mark
1585	El Presupuesto cuenta también con 75 millones que se comprometieron con el club Atlético San Sebastián para la realización del campo de hockey que ya está culminado.	se-mark
1586	Entre los regresos destacaron la vuelta del veterano Cañizares, portero del Valencia, y la de su compañero Vicente, que se recupera de una lesión en el tobillo.	expl
1587	Como explica la doctora Eva Ferrer Vidal–Barraquer en su libro Cambia de vida, ponte a correr, se queman «a razón de 100 calorías por cada 1,5 kilómetros recorridos, así que para perder 0,5 kg hay que quemar 3.500 calorías.	se-mark
1588	Los premios se entregarán el sábado en el Olivar Chico.	se-mark
1589	Por su parte, el campeón del mundo de 250 cc se mostró muy satisfecho con su pole provisional.	obj
1590	Nosotros ya queríamos sacar una nota, pero por lo visto algunos no han querido esperar», me comentaba el propio Jordi Cruyff tras conocerse la noticia.	se-mark
1591	Pero no se engañe, la gente sigue el fútbol.	iobj
1592	La mayor parte de su vida transcurrió en Madrid como empleado de una empresa de aviación civil y tras su jubilación decidió instalarse en Torrijos, donde ha encontrado la muerte.	expl
1593	Las olas se llevaron a uno de cada dos habitantes de un pequeño pueblo de la región indonesia de Aceh.	expl
1594	Tras once días sin tregua en un pelotón que ha visto como 24 corredores abandonaban la vuelta se preve una lucha por el liderato.	se-mark
1595	Una vez el traficante se aseguró de que portaba uno de los décimos le dijo que no había acuerdo y le invitó a dejar el piso.	expl
1596	En poco más de dos horas Randy Orton se convirtió en bicampeón de la WWE, el mismo tiempo que invirtió Triple H en ganar y perder su décimoprimer título mundial.	expl
1597	Propuesta su creación por Alfonso XIII en 1929, ha servido y sirve como referencia a miles de personas que cada año se sienten atraídas por los atractivos naturales del Macizo Central de la Sierra de Gredos.	expl
1598	En Córdoba, en la avenida de América, el sufrido peatón debe cruzar al más puro estilo Carl Lewis, pues se le abalanzan a toda velocidad los vehículos que giran a la izquierda desde la avenida de Cervantes.	expl
1599	Encuentro escasamente fluido el del primer tiempo, ya que se ha encallado demasiado en el centro del campo, donde ninguno de los dos equipos ha abanderado el fútbol pausado de toque.	expl
1600	Francisco José Hoya, responsable del Espanyol femenino, deplora que siempre que se habla de las jugadoras sea por razones a las que son totalmente ajenas.	se-mark
1601	"Ha ayudado el 8 – 3 que le metió al Dépor en el grupo de clasificación y también la capacidad de Morientes, de Prso, de Giuly, la nueva estrella del fútbol francés	  y el toque Deschamps, el jugador que más veces ha vestido la camiseta francesa, que llegó"	expl
1602	Y a eso se dedicó su equipo.	expl
1603	Luis Berdejo, donostiarra de 35 años, que después de pasarse siete intentando dirigir un largometraje lo ha logrado en Estados Unidos, con Kevin Costner como protagonista en The New Daughter.	expl
1604	El lujo es degustarla al anochecer en la azotea dejándose envolver por la música de jazz, cuya sutileza no quiebra un silencio habitado por pasos lejanos o por el rumor de una charla en el patio de la iglesia.	expl
1605	Los perfiles deben marcarse más intensamente.	se-mark
1606	Pero parece que este curso el alemán, que se guardó algunas gomas para la carrera y partirá quinto -a cuatro décimas del mejor tiempo-, ya no viaja en cohete sino en un 'RB8' un punto por debajo de los McLaren e incluso de Mercedes GP.	expl
1607	Su entorno es fascinante y en él podemos apreciar multitud de aves acuáticas como cormoranes, patos, garzas, fochas y pollas de agua, además de ofrecer una deliciosa estampa con la sierra y los bosques que se reflejan en sus serenas aguas.	expl
1608	Schaueble está preocupado porque ante un acontecimiento de la magnitud del Mundial de Fútbol la policía alemana se vea desbordada en caso de atentado terrorista.	obj
1609	Sin embargo, el secretario de UAGA-Huesca, José Manuel Penella, afirmó que «siempre hemos avisado con 48 horas de antelación y nunca se nos había negado».	se-mark
1610	También debía presentarse la víspera de Año Nuevo en el B. B. King Blues Club and Grill en Nueva York.	iobj
1611	En la medida de lo posible se evitará que las autoridades locales suban a bordo de la aeronave, dice el protocolo.	se-mark
1612	La cocina de las trufas en España se encuentra en fase incipiente a pesar de que grandes cocineros como Santi Santamaría, Carme Ruscalleda, Carmelo Bosque, Fernando Abadía, Nando Jubany y algunos otros elaboran platos brillantes.	se-mark
1613	Sea para aguijonear a los futbolistas, a quienes provoca, o para posicionarse ante la opinión pública.	expl
1614	Los niños podrían volver mañana a las clases, pero no lo harán mientras no se realice un examen epidemiológico.	se-mark
1615	Desde la cama se rompen.	se-mark
1616	Era normal que pasara lo que pasó, aunque Casillas, al encontrarse el micrófono del Canal+, exclamó: ¡Esto no es normal!.	expl
1617	Del golpetazo, el chico se desplomó en el suelo, quedó inconsciente al menos diez minutos y empezó a echar sangre por la boca.	expl
1618	En ese aspecto creo que es necesario la presión y movilización social para reivindicar que si estamos en un nuevo tiempo se den pasos en el ámbito de la política penitenciaria para reafirmarlo, ha expresado.	se-mark
1619	En el transcurso de la misma, y mientras los asistentes disfrutan con la animación de una charanga, se repartirá entre los asistentes vino, licores y pastas.	se-mark
1620	El ciclismo siempre ha estado en el ojo del huracán por los escándalos que se han producido en los últimos años.	se-mark
1621	La presente edición del campeonato fue, sin lugar a dudas, la más interesante y numerosa de cuantas se han celebrado, tanto en número de empresas colaboradoras, como en la calidad de los premios o en el nivel de juego.	se-mark
1622	La raqueta se situó en un plano, si no secundario, sí paralelo al de sus actividades publicitarias.	se-mark
1623	Entre ellas se coló una Yamaha.	expl
1624	Otro español, Héctor Barberá, fue tercero al ser batido por el francés Mike di Meglio (Aprilia) tras disputarse esa plaza los dos en solitario en las últimas vueltas.	iobj
1625	Entre las tres debían repartir se las medallas, y en efecto lo hicieron, pero Savinova fue la más rápida.	iobj
1626	Ayer se vivió en Mendizorroza uno de los episodios más grotescos de la ya larga lista de despropósitos generados por el dueño del club.	se-mark
1627	Una investigación actual que incluye al manager holandés Jos Hermens y al médico español Ángel Peraita, al que se considera relacionado con el Eufemiano Fuentes, protagonista de la Operación Puerto.	se-mark
1628	Aunque resta todavía mucha competición por delante, los puntos en juego empiezan a cobrar más trascendencia porque las jornadas para recuperar el terreno perdido también se acortan.	se-mark
1629	Generalmente los materiales que se utilizan y las herramientas son baratas.	se-mark
1630	España se quedó sin milagro.	expl
1631	También se puede venir y no estar, que es lo que hizo Carmen Kass durante la rueda de prensa.	se-mark
1632	Las declaraciones recientes de ASO, RCS y Unipublic deben considerarse totalmente contrarias al reglamento, asegura la UCI en un comunicado en el que insiste en que todos los equipos beneficiarios de una licencia ProTour tendrán el derecho y la obligación	se-mark
1633	La tarraconense selló una marca de 67.74 y se quedó a 118 centímetros del registro de la última de las doce finalistas, la francesa Stéphanie Falzon, mientras que la mejor fue la china Wenxiu Zhang (74.17).	expl
1634	Sale de la sala sin que su mirada se encuentre con la del hijo, pero también sin que sus palabras le causen más quebranto.	expl
1635	Los innumerables saltos y cascadas, columnas de espuma donde se apoya su paisaje.	expl
1636	Simpson se quedó en 11s clavados, una magnífica marca dado el 1,2 metros por segundo de viento en contra.	expl
1637	¿Puede tener éxito un restaurante gallego que se centra en recetas de la cocina tradicional al estilo de las casas de comidas de Betanzos (A Coruña) y casi da la espalda a los mariscos?	expl
1638	Pero aún muestra esa ansiedad por el triunfo que en el Manchester se alimenta sin arañazos.	iobj
1639	Es una buena forma de decidir qué se puede dejar en casa.	se-mark
1640	A priori, ninguno de los dos equipos se puso de manifiesto en los primeros minutos.	expl
1641	Antes de la cita suiza, Ruth ya se había impuesto en Oslo (1,90), Estocolmo (1,93), Londres (1,98) y París (1,98).	expl
1642	Por otra parte, medio centenar de personas se concentró en la plaza Mayor de Castellón para mostrar su rechazo a la violencia contra las mujeres y guardaron un minuto de silencio en recuerdo de las víctimas.	expl
1643	A lo que su hermana Chabeli añade: «Los hombres se quejan más.	expl
1644	Lo peor está en la costa azotada por el tsunami, convertida en un caos de lodo y escombros, donde poco a poco se extinguen las esperanzas de encontrar supervivientes y espera un largo trabajo de reconstrucción.	se-mark
1645	De momento la incógnita es en qué estado de forma se encuentra el delantero tras superar una rotura de ligamentos de la rodilla izquierda que le mantuvo desde el pasado enero seis meses apartado de los terrenos de juego.	se-mark
1646	El Chelsea, en cambio, logró una cómoda victoria contra el Birmingham (3-1) y se vengó de la derrota sufrida en Saint Andrews en la primera vuelta.	expl
1647	Los tres equipos se incorporaron oficialmente a la Unión.	expl
1648	Si careciese de acidez se haría más pesado y, al contrario, lo dota de armonía.	se-mark
1649	Nos estamos refiriendo a cuando la lucha es más libre que nunca, es decir, que se hace sin tapujos... sin tapujos, sin bragas y sin sujetador: combates entre mujeres que llevan menos ropa que las divas de la WWE... vamos, que van en cueros.	se-mark
1650	No obstante, tres minutos después de esta jugada y en un despiste de la defensa, el delantero visitante Dezzotti acortó las distancias en el marcador, hecho que consiguió meter en el partido al Granada, que estuvo mucho más activo, volcándose en búsqueda 	expl
1651	No se piden explicaciones.	se-mark
1652	Antes de llegar a Benitatxell de nuevo se produjo una fuga compuesta por Pina, Moltó, Gallardo, Martí, Berenguer, Torrijo, Giner, Méndez y Andrés que con un perfecto trabajo de relevos continuos consiguieron una máxima renta de 1 minuto y 40 segundos.	se-mark
1653	Yo siempre trabajo para ser titular, independientemente de la competición que se juegue, ya sea Liga o Copa.	se-mark
1654	La menor de las Williams, de 30 años, se impuso por 6-1, 5-7 y 6-2 a Agnieska Radwanska.	expl
1655	El también ex jugador Juan Manzanedo ahondaba en la bonanza de los tiempos pasados: «¡Qué épocas aquellas en que había que jugar y pegarse [...] con las gentes que, al vernos en calzoncillos, nos llamaban locos, los mismos que hoy pagan seis pesetas por v	expl
1656	Durante todo el fin de semana, Alonso había descartado la posibilidad, y nunca se mostró muy entusiasmado.	iobj
1657	Neymar da Silva, delantero brasileño del Santos que se encuentra concentrado con su selección en víspera del inicio de la Copa América es innegociable por razones, técnicas, de mercado y afectivas, afirmó el presidente de su club, Luis Alvaro de Oliveira 	expl
1658	Los primeros que se apuntan son las dos grandes peñas futbolísticas de la ciudad: la sevillista Peña Biri y la verdiblanca Peña el Chupe.	obj
1659	Normalmente, cuando un señor va a adquirir una camisa se fija principalmente en el diseño de la misma para orientar su elección.	expl
1660	En las escuelas21 el espacio educa, se dirige a facilitar el aprendizaje.	se-mark
1661	Si se trataba de formar y perfeccionar directivos, hay que hacerlo en aquello que no enseñaban en la universidad ni en las academias: la toma de decisiones.	se-mark
1662	Con estos condicionantes, el concejal de Turismo calculó que, como máximo, la Ruta Romana tendría capacidad para acoger a quince mil visitantes anuales, si se realizara todos los días del año sin descansos y todos los grupos estuvieran completos.	se-mark
1663	El mejor tiempo de los coches de 2011 ha sido el establecido por el alemán Michael Schumacher (Mercedes GP), a 1,336 segundos del crono de Sutil, mientras que en la cuarta plaza se ha situado el australiano Mark Webber (Red Bull), a tan sólo 47 milésimas 	expl
1664	A petición del club, el partido contra el Zaragoza, previsto inicialmente para las diez de la noche de hoy, se aplaza hasta las seis de la tarde del domingo.	se-mark
1665	Al margen de La Manzanilla, en el último mes tambén se compitió en la pista de El Mayorzago de La Orotava y el Estadio Antonio Domínguez en Los Cristianos, en Arona.	se-mark
1666	Con seis Juegos Olímpicos a sus espaldas, Jesús Carballo quería despedir se de su cargo de seleccionador después de los de Pekín 2008.	expl
1667	El Banco Gallego se ha convertido en su gran patrocinador y uno de sus principales impulsores financieros.	expl
1668	Los diablos pertenecían al gremio de los matarifes, los morenos eran vendedores de coca, los veleros conformaban el grupo de los incas y los llamados carreritos se agrupaban en la comparsa de los tobas.	expl
1669	Coloccini quiere quedarse.	expl
1670	9. También se pueden plantar en febrero especies bulbosas de floración primaveral como Anémonas o Ranúnculos.	se-mark
1671	Sin embargo, en la última aproximación local del encuentro, el Valencia marcó el gol de la victoria, que le mantiene en la lucha por la cuarta posición y que se convirtió en un castigo excesivo para el Valladolid.	expl
1672	El Barcelona se complicó las cosas más de lo debido en su segundo partido de pretemporada.	iobj
1673	Según ha anunciado la cadena, la emisora WQHT ha suspendido a los miembros de 'Miss Jones in the morning', presentado por la dj Tarsha Nicole Jones, que se hace llamar 'Miss Jones'.	iobj
1674	«Señora» o «Señoría» pueden utilizarse en todos los casos.	se-mark
1675	Un poco más alejados se encontraban en esos instantes Frédéric Duthil, actual líder, o Nicolas Berenguer, tercero en la clasificación provisional, aunque por supuesto nada está decidido cuando aún faltaban 430 millas.	expl
1676	Quizás ahora se le ha quedado un poco pequeño, ya que su proyección es enorme.	se-mark
1677	Moyà se resintió, en cambio, del problema en el tobillo derecho que le había impedido jugar la Copa Davis en Brno a principios de este mes.	expl
1678	Un buen día dejaron de funcionarle los riñones y tuvo que someterse a durísimas sesiones de diálisis en La Paz.	obj
1679	El contraataque local provocó una falta sobre San Emeterio: veintitrés segundos por jugar, 70-69 y tiempo muerto de un Poch que no se creía que pudieran dejar escapar el partido.	expl
1680	Algo que resulta incómodo porque cuando hay que poner la lavadora hay que quitar la televisión para que no se le salten los plomos a la vecina», detalla Ana María.	expl
1681	BOIBO, por tanto, insiste en la idea de generar una experiencia, en la que el diseñador no delimita y acota perfectamente el producto final, sino que deja abierta al usuario la posibilidad de vivir esta, expresarse y crear su realidad, en la línea de lo q	expl
1682	Su chut fue de una violencia tan bella que Andersen no se molestó ni en subir las manos para intentar estropearlo.	expl
1683	Jiménez, Harrington y Kingston comenzaron el último día como líderes empatados a 200 golpes y durante el último recorrido fueron alternándose al mando de la clasificación, hasta que en el hoyo 12 Jiménez consiguió una ligera ventaja de un golpe, gracias a	obj
1684	De hecho, algunas comunidades que no disponían de puertas en su barrio se quejaron al rey de que esta situación los dejaba indefensos.	expl
1685	"Lo hicimos con decisión y para ello contamos con la colaboración de Rafael Díaz, El de Bostronizo, gran amigo, que se hizo cargo de la construcción de la bolera sin cobrar nada	 de Ismael Terán, que fue compañero de bolos y amigo íntimo, que construyó el "	expl
1686	Era el minuto cinco y el Atlético ya se había aposentado frente a Codina con un juego directo, enganchado a las ocurrencias de Diego Costa, cuando Falcao corroboró la certeza del refrán: el mejor escribano echa un borrón.	expl
1687	Luis Aragonés ha ganado más que una Eurocopa, ha ganado el respeto y el reconocimiento de toda España y de todo el mundo del fútbol, le ha ganado un pulso a la prensa como pocos han logrado hacer, se ha ganado un puesto de honor en la historia del fútbol,	expl
1688	Con un par de maniobras de pizarra, ambas en la misma vuelta (la 13), se deshizo de Pedrosa y de Rossi como si estuviera tratando con motociclistas en prácticas.	expl
1689	En el día de las víctimas del terror estalinista, que en 2007 tiene un significado especial por conmemorarse el 70 aniversario de las purgas masivas iniciadas en 1937, Putin depositó una corona de flores junto a una cruz erigida en el polígono de tiro de 	se-mark
1690	Las obras en el puerto para la pasada vuelta al mundo de regatas Volvo Ocean Race -que volverá a zarpar de aquí en 2011- sirvieron para crear una zona comercial, pero la verdadera hipnosis que desprende la ciudad está en su esencia: accesible, internacion	se-mark
1691	No creemos que alguien que está poniendo bombas pueda dedicarse  a tropezar con la gente.	expl
1692	Para terminar la copa, se llena de nata montada.	se-mark
1693	Y, eso sí, las fábricas: al día siguiente de la proclama del Führer empezaron a construirse varias.	se-mark
1694	El estadounidense Lucas Glover lidera con 6 golpes bajo par el Abierto de los Estados Unidos de golf que se disputa en Bethpage (Nueva York), después de que quedase interrumpida la segunda jornada por falta de luz.	se-mark
1695	La situación judicial de Caminero no se puede desvincular ahora de la imagen del Atlético de Madrid, y ese hecho preocupa bastante a los dueños.	se-mark
1696	Schröder se reunió ayer de urgencia con los jefes de los grupos parlamentarios del Bundestag para tratar de frenar la polémica en Alemania.	expl
1697	Su equipo, Rabobank, informó en un comunicado que Freire no está recuperado de la fractura de dos costillas y de las heridas que se hizo en los codos, que le impiden pedalear con normalidad.	obj
1698	Asimismo, el nuevo puente de El Granado-Pomarão, inaugurado en febrero de 2009, está suponiendo un revulsivo para que se conozcan los atractivos de este territorio interior del Bajo Guadiana.	se-mark
1699	Esta primitiva asociación se encarga de redactar unas reglas básicas para el juego, organiza el gran flujo de golfistas existentes e instituye los primeros clubes.	iobj
1700	En su apertura hicieron varios pasos en artificial, pero al poco tiempo, la vía fue recorrida totalmente en libre por Ortega, en compañía del joven David Munilla, que aún sin tener tan alto nivel se enganchó a este gran escalador jerezano.	iobj
1701	Renato, con un gran disparo desde fuera del área, hizo el segundo justo después de que el debutante Valiente se jugara el penalti ante Nino.	expl
1702	Silvia Gaviro creía (no era la única) que eso es un problema, sobre todo para su club, que estaba en el grupo a priori más flojo, lo cual no fue obstáculo para que se alzaran con el título de campeonas de Liga de la temporada 1999-2000.	expl
1703	Por culpa de ese fallo, a Fernando se le habían escapado de las manos los diez puntos de la victoria que ya casi tenía en el bolsillo.	expl
1704	La joven de 22 años Mónica F. M. falleció hoy después de permanecer en coma en el Hospital Universitario Río Hortega de Valladolid como consecuencia de las heridas sufridas en el accidente múltiple ocurrido el miércoles pasado en la N-620, en el término d	se-mark
1705	No obstante, como finalmente no todos los heridos por las colisiones han necesitado intervenciones quirúrgicas -la mayoría sufría fracturas y contusiones-, se ha vuelto a abrir la actividad en dos quirófanos.	se-mark
1706	Paga igual que éstos y, como es natural, exige ver algo que corresponda al desembolso que ha realizado por ver ese espectáculo y es materialmente imposible conciliar ese derecho con la poca importancia que dan los jugadores amateurs a presentarse en públi	expl
1707	Mientras que cuando lo hace su madre, llora y patalea como si se acabara el mundo.	se-mark
1708	La formación Columbia venció ayer sábado en la primera etapa del Giro de Italia, una contrarreloj por equipos de 20,5 kilómetros en Venecia, tras la cual el británico Mark Cavendish se vistió con la 'maglia rosa' de líder de la general.	obj
1709	Poco fútbol vistoso ofrecieron ambos bloques en los primeros 45 minutos, en los que los parecieron estar más pendientes de que su rival no se acercara a su portería que de buscar con claridad la adversaria.	expl
1710	Las otras cinco plazas se las disputan 12 tenistas, separados apenas por 100 puntos.	iobj
1711	Hoy el Madrid preparará el partido de ida de Copa contra el Rayo, que se jugará mañana en el Bernabéu.	se-mark
1712	La media de los que optan a un piso actualmente no se sabe aún, pero será mayor porque entonces la edad límite era de 30 años y ahora es de 35.	se-mark
34	Es la gran sorpresa del momento porque se está defendiendo de manera sobresaliente.	obj
35	Sobre el paisaje que rodea la masía San Jaime, el refugio ideal del modisto, siguen jugando las gotas de agua que se esconden entre el césped y las chumberas.	obj
41	Gough, ex militar de la Marina británica, ha sido advertido de que podría dar con sus huesos en prisión para siempre si no accede, de una vez por todas, a vestirse, según informa hoy el diario británico The Independent.	obj
133	Con el terremoto de la ampliación de capital flotando en el ambiente, la plantilla azul ha intentado abstraerse del tema para pensar solo en la dura prueba que depara la Liga tras el parón navideño.	obj
142	Por último, Atlético de Madrid y Rayo se enfrentarán el jueves.	obj
217	En junio, tienen por primera vez la posibilidad de representarse en Lausana ante los miembros del COI.	obj
263	"Entre los diferentes actos destacan los desfiles del barrio de Zizkov de Praga, en los que el alcalde se disfraza de oso	 el desfile de máscaras en el escansen -museo al aire libre- de Roznov por Rahostem el 5 de febrero	 degustación de platos típicos de "	obj
316	Cuando yo me aficioné a esto, hace medio siglo, el centro del campo sólo eran dos medios sin pretensiones de estrellas y cuya única misión consistía en pasar con cierta precisión a los extremos para que, internándose como rayos por las bandas, centraran a	obj
318	Así que la fiel afición azul se armó de paciencia y lo fió todo a sus delanteros.	obj
362	Jesús se había comprometido a invitarnos, y lo hace, aunque intentó compartir gastos.	obj
388	Las bandas de ataque del conjunto rojiblanco estarán ocupadas por el rumano Contra, que podría disputar ante el Sevilla sus primeros minutos de la temporada tras lesionarse de gravedad durante la pretemporada, en la derecha, y el holandés Musampa, que jug	obj
497	La relación sentimental entre Fox y Sahagún, que no se pudieron casar por la Iglesia porque ambos son divorciados y no tienen la nulidad eclesiástica de sus matrimonios anteriores, era un secreto a voces en México, aunque nunca había sido confirmada ofici	obj
572	El anuncio lo hicieron hoy en un comunicado fechado en Londres el Rey Constantino de Grecia y su esposa, Ana María, que se dicen encantados porque van a ser abuelos por séptima vez.	obj
581	En Estambul hay más de 300 mezquitas abiertas a la visita de los turistas, que deberán descalzarse y, si coinciden con la oración, quedar en un espacio reservado para ellos.	obj
598	Su crecimiento en las categorías inferiores siguió a buen ritmo en los siguientes años, y su gran día llegó en 2001, cuando se proclamó en Amsterdam campeón de Europa sub'23 y subcampeón de la Universiada en Beijing.	obj
631	El domingo, a primera hora de la mañana y con un tiempo espléndido, el grupo de participantes se despedía con la ilusión y las ganas de volver a estar de nuevo juntos el próximo año.	obj
638	Pedro Subijana es un tipo entregado con la fuerza para superarse a sí mismo, puro, exquisito y entusiasta.	obj
647	El brasileño estaba enfadado: Ito recupera balones pues es como mejor se defiende, él regatea porque es lo que sabe hacer.	obj
